{
  "contract_version": 1,
  "model_id": "model-missing-source",
  "system_under_analysis": "Minimal API",
  "scenario": "A user agent sends a request.",
  "dfd_detail_level": "high-level",
  "abstraction_level": "spec-review",
  "scope": [],
  "out_of_scope": [],
  "source_inventory": [],
  "external_entities": [
    {
      "stable_id": "EE-01",
      "type": "External Entity",
      "name": "Service",
      "description": "Remote service.",
      "evidence_status": "supplied",
      "source_reference": "",
      "confidence": "high",
      "notes": ""
    }
  ],
  "processes": [],
  "data_stores": [],
  "data_flows": [],
  "trust_boundaries": [],
  "assumptions": [],
  "inline_safeguards": [],
  "implicit_threat_model_signals": [],
  "review_signals": [],
  "unresolved_questions": [],
  "validation_notes": []
}
